name|author_name|instruction
Beef Bourguignon|Julia Child|(beef,2 lbs)|(onions,1 sliced)|(mashed garlic,2 cloves)|(butter, 3.5 Tbsp)|(tomato paste,1Tbsp)|Braise the beef. Saute the onions and carrots. Add wine and cook in a dutch oven at 425 degrees for 1 hour.
Ratatouille|Julia Child|(eggplant,1 lb)|(zucchini,1 lb)|(mashed garlic,2 cloves)|(olive oil,4-6 Tbsp)|(yellow onion, 1 1/2 cups or 1/2 lb thinly sliced)|Peel and cut the egglant. Make sure you cut eggplant into lengthwise slices that are about 1-inch wide, 3-inches long, and 3/8-inch thick.
Salade Nicoise|Julia Child|(olive oil,2-3 Tbsp)|(green beans,1 1/2 lbs blanched, trimmed)|(tuna,8-10 ozs oil-packed, drained and flaked)|(tomatoes, 3 or 4 red, peeled, quartered, cored, and seasoned)|(hard-boiled eggs,8 halved lengthwise)|Take a salad bowl or platter and line it with lettuce leaves, shortly before serving. Drizzle some olive oil on the leaves and dust them with salt.
Wild Mushroom Stroganoff|Emeril Lagasse|(egg noodles,16 ozs wide)|(olive oil,3 Tbsp)|(mushrooms,2 lbs wild or exotic, cleaned, stemmed, and sliced)|(yellow onion,1 cup thinly sliced)|Cook the egg noodles according to the package directions and keep warm. Heat 1 1/2 tablespoons of the oliveoil in a large saute pan over medium-high heat.
Spicy Meatloaf|Emeril Lagasse::(bacon,3 ozs diced)|(onion,2 cups finely chopped)|(celery,2 cups finely chopped)|(green bell pepper,1/4 cup finely chopped)|(ground beef,1 1/2 lbs chuck)|(pork sausage,3/4 lbs hot)::Preheat the oven to 375 degrees F. Cook bacon in a large skillet over medium heat until very crisp and fat has rendered, 8-10 minutes.
Oysters Rockefeller::James Beard::(shallots,1/4 cup chopped)|(celery,1/4 cup chopped)|(chervil,1 tsp)|(fennel,1/3 cup chopped)|(parsley,1/3 cup chopped)|(oysters, 2 dozen on the half shell)|(Pernod,1/3 cup)::Saute the shallots, celery, herbs, and seasonings in 3 tablespoons of the butter for 3 minutes. Add the watercress and let it wilt.
Carrot Soup::Alice Waters::(butter,4 Tbsp)|(onions,2 medium sliced)|(thyme,1 sprig)|(carrots,2 1/2 lbs, peeled and sliced)|(chicken broth,6 cups)::In a heavy-bottomed pot, melt the butter. When it starts to foam, add the onions and thyme and cook over medium-low heat until tender, about 10 minutes.
Roast Pork Loin::Alice Waters::(pork loin,1 bone-in, 4-rib)|(red wine,1/2 cup)|(chicken broth,1 cup)|The day before, separate the meat from the ribs, stopping about 1 inch before the end of the bones. Season the pork liberally inside and out with salt and pepper and refrigerate overnight.
